{
  "schemaVersion": "1.0.0",
  "contractId": "cursor-hook-bom-compatibility-hotfix-v1",
  "phaseId": "CHBOM-PHASE-1",
  "implementer": "Codex",
  "implementationState": "IMPLEMENTED_UNVERIFIED",
  "changedFiles": [
    ".cursor/hooks/governance-guard.mjs",
    "tools/execution-governance/red-team-harness.mjs",
    "docs/execution-governance/CURSOR_HOOK_BOM_COMPATIBILITY_HOTFIX_EVIDENCE.md",
    "docs/RISK_REGISTER.md",
    "HANDOFF_FOR_NEXT_CODEX.md",
    ".execution-governance/plans/cursor-hook-bom-compatibility-hotfix-v1/lifecycle-record.json",
    ".execution-governance/plans/cursor-hook-bom-compatibility-hotfix-v1/implementation-report.json"
  ],
  "commandsRun": [
    {
      "command": "node tools/execution-governance/red-team-harness.mjs",
      "exitCode": 0,
      "result": "PASS"
    },
    {
      "command": "node tools/execution-governance/governance-cli.mjs run-checks --plan-dir .execution-governance/plans/cursor-hook-bom-compatibility-hotfix-v1",
      "exitCode": 0,
      "result": "PASS",
      "artifactPath": ".execution-governance/runtime/run-records/run-2026-08-24T23-29-54-819Z-24936.json"
    },
    {
      "command": "node tools/execution-governance/governance-cli.mjs doctor",
      "exitCode": 0,
      "result": "PASS"
    },
    {
      "command": "node tools/execution-governance/governance-cli.mjs validate",
      "exitCode": 0,
      "result": "PASS"
    },
    {
      "command": "node tools/execution-governance/governance-cli.mjs scope-check --plan-dir .execution-governance/plans/cursor-hook-bom-compatibility-hotfix-v1",
      "exitCode": 0,
      "result": "PASS"
    },
    {
      "command": "git diff --check",
      "exitCode": 0,
      "result": "PASS"
    },
    {
      "command": "node tools/execution-governance/governance-cli.mjs postflight --plan-dir .execution-governance/plans/cursor-hook-bom-compatibility-hotfix-v1",
      "exitCode": 1,
      "result": "FAIL"
    }
  ],
  "artifacts": [
    "docs/execution-governance/CURSOR_HOOK_BOM_COMPATIBILITY_HOTFIX_EVIDENCE.md",
    ".execution-governance/runtime/run-records/run-2026-08-24T23-26-42-977Z-10308.json",
    ".execution-governance/runtime/run-records/run-2026-08-24T23-29-54-819Z-24936.json"
  ],
  "scopeChangeRequests": [],
  "verifierChangeRequests": [],
  "waivers": [],
  "independentReview": "NOT_REQUESTED",
  "residualRisks": [
    "Governance postflight fails because the current governance CLI compares lock.json baseCommit f069f5250c1d1669a18fea58ab7a94568532a2e3 with current HEAD de50be880d2cbce53aa4ac23582fe69830e28cce after the separate plan-lock commit.",
    "Remote CI evidence remains unavailable until a separately authorized push and GitHub Actions run.",
    "Production remains NO-GO."
  ]
}
