{
  "schemaVersion": "1.0.0",
  "contractId": "hosted-sandbox-verifier-setup-v1",
  "phaseId": "HS-FAZ-0",
  "implementer": "Cursor Grok",
  "implementationState": "EXECUTOR_VERIFIED",
  "changedFiles": [
    ".execution-governance/plans/hosted-sandbox-verifier-setup-v1/plan.md",
    ".execution-governance/plans/hosted-sandbox-verifier-setup-v1/contract.json",
    ".execution-governance/plans/hosted-sandbox-verifier-setup-v1/scope.json",
    ".execution-governance/plans/hosted-sandbox-verifier-setup-v1/acceptance.json",
    ".execution-governance/plans/hosted-sandbox-verifier-setup-v1/lock.json",
    ".execution-governance/plans/hosted-sandbox-verifier-setup-v1/lifecycle-record.json",
    ".execution-governance/plans/hosted-sandbox-verifier-setup-v1/implementation-report.json",
    ".execution-governance/plans/hosted-sandbox-environment-assurance-v1/plan.md",
    ".execution-governance/plans/hosted-sandbox-environment-assurance-v1/contract.json",
    ".execution-governance/plans/hosted-sandbox-environment-assurance-v1/scope.json",
    ".execution-governance/plans/hosted-sandbox-environment-assurance-v1/acceptance.json",
    ".execution-governance/plans/hosted-sandbox-environment-assurance-v1/lock.json",
    ".execution-governance/plans/hosted-sandbox-environment-assurance-v1/lifecycle-record.json",
    ".execution-governance/plans/hosted-sandbox-environment-assurance-v1/implementation-report.json",
    "app/scripts/verify-hosted-sandbox-contracts.mjs",
    "tools/hosted-sandbox/run-verifier.mjs",
    "tools/hosted-sandbox/lib/identity.mjs",
    "tools/hosted-sandbox/lib/negative-controls.mjs",
    "tools/hosted-sandbox/hosted-sandbox-verifier.test.mjs",
    "docs/execution-governance/HOSTED_SANDBOX_PHASE_0_VERIFIER_SETUP_EVIDENCE.md",
    "HANDOFF_FOR_NEXT_CODEX.md"
  ],
  "commandsRun": [
    {
      "command": "node tools/execution-governance/governance-cli.mjs doctor",
      "exitCode": 0,
      "result": "PASS"
    },
    {
      "command": "node tools/execution-governance/governance-cli.mjs validate",
      "exitCode": 0,
      "result": "PASS"
    },
    {
      "command": "node tools/execution-governance/governance-cli.mjs validate --plan-dir .execution-governance/plans/hosted-sandbox-verifier-setup-v1",
      "exitCode": 0,
      "result": "PASS"
    },
    {
      "command": "node tools/execution-governance/governance-cli.mjs validate --plan-dir .execution-governance/plans/hosted-sandbox-environment-assurance-v1",
      "exitCode": 0,
      "result": "PASS"
    },
    {
      "command": "node tools/execution-governance/red-team-harness.mjs",
      "exitCode": 0,
      "result": "PASS"
    },
    {
      "command": "node app/scripts/verify-hosted-sandbox-contracts.mjs",
      "exitCode": 0,
      "result": "PASS",
      "artifactPath": ".execution-governance/runtime/hosted-sandbox/"
    },
    {
      "command": "node --test tools/hosted-sandbox/hosted-sandbox-verifier.test.mjs",
      "exitCode": 0,
      "result": "PASS"
    },
    {
      "command": "node tools/execution-governance/governance-cli.mjs run-checks --plan-dir .execution-governance/plans/hosted-sandbox-verifier-setup-v1",
      "exitCode": 0,
      "result": "PASS",
      "artifactPath": ".execution-governance/runtime/run-records/"
    },
    {
      "command": "node tools/execution-governance/governance-cli.mjs scope-check --plan-dir .execution-governance/plans/hosted-sandbox-verifier-setup-v1",
      "exitCode": 0,
      "result": "PASS"
    },
    {
      "command": "node tools/execution-governance/governance-cli.mjs postflight --plan-dir .execution-governance/plans/hosted-sandbox-verifier-setup-v1 --allow-dirty",
      "exitCode": 0,
      "result": "PASS"
    },
    {
      "command": "git diff --check",
      "exitCode": 0,
      "result": "PASS"
    }
  ],
  "artifacts": [
    "docs/execution-governance/HOSTED_SANDBOX_PHASE_0_VERIFIER_SETUP_EVIDENCE.md"
  ],
  "scopeChangeRequests": [],
  "verifierChangeRequests": [],
  "waivers": [],
  "independentReview": "NOT_REQUESTED",
  "residualRisks": [
    "lockCommit is empty; LOCKED_FOR_IMPLEMENTATION requires a separate user-approved commit.",
    "Faz 1 product work is not authorized by this phase.",
    "Production remains NO-GO."
  ]
}
